{
  "version": 1,
  "name": "path-casing-mismatch-app",
  "authority": {
    "productTruth": ["PRODUCT.md"],
    "executionTruth": [],
    "workflowRules": ["AGENTS.md"],
    "doNotUseAsAuthority": []
  },
  "orientation": {
    "readFirst": ["AGENTS.md"],
    "readBeforeBroadSearch": ["docs/ARCHITECTURE.md"],
    "sectionedDocs": []
  },
  "modes": [
    {
      "id": "planning",
      "useWhen": "Planning only.",
      "requiredGates": [],
      "codeFacing": false
    }
  ],
  "tracker": {
    "provider": "none",
    "authorityRule": "Tracker reflects execution state.",
    "recordWhen": [],
    "dispositions": ["none"]
  },
  "codeIntelligence": {
    "provider": "focused-search",
    "availability": {
      "configuredPreference": "focused-search",
      "detectedRepoSupport": "not-required",
      "currentHostAvailability": "not-required",
      "fallbackCommandReadiness": "not-required"
    },
    "mcp": null,
    "wrapperFallback": null,
    "statusCommand": null,
    "refreshCommand": null,
    "queryCommand": null,
    "contextCommand": null,
    "impactCommand": null,
    "detectCommand": null,
    "fallback": "Use focused source search."
  },
  "contracts": {
    "featureArtifacts": [],
    "stateContracts": [],
    "surrogates": []
  },
  "verification": {
    "focusedChecksFirst": true,
    "requiredCommands": [],
    "optionalCommands": [],
    "knownFailures": null,
    "browser": {
      "provider": "none",
      "origin": null,
      "artifacts": null,
      "policy": "Use an explicit skip reason."
    }
  },
  "uiUx": {
    "designSystemDocs": [],
    "visualSignoff": "human",
    "browserEvidencePolicy": "functional-only unless explicitly configured"
  },
  "manifest": {
    "defaultDir": "tmp/apex-workflow",
    "finishPacket": [
      "What landed",
      "Mode",
      "Downshift proof",
      "Owned files",
      "No-touch preserved",
      "Verified commands",
      "Failed / skipped checks",
      "Code-intelligence scope",
      "Tracker update",
      "Next safe slice"
    ]
  }
}
