{
  "version": 1,
  "name": "service-desk",
  "description": "Non-Minty example profile for a small service desk app with no tracker, graph tooling, or browser automation.",
  "operatorCautions": [],
  "authority": {
    "productTruth": ["PRODUCT.md"],
    "executionTruth": [],
    "workflowRules": ["AGENTS.md"],
    "doNotUseAsAuthority": []
  },
  "orientation": {
    "readFirst": ["AGENTS.md"],
    "readBeforeBroadSearch": ["README.md"],
    "sectionedDocs": []
  },
  "modes": [
    {
      "id": "tiny",
      "useWhen": "Single known file, low risk, no durable tracker state.",
      "requiredGates": ["direct file read", "path-scoped check"],
      "codeFacing": true
    },
    {
      "id": "route-local",
      "useWhen": "One owner with obvious callers.",
      "requiredGates": ["manifest", "owner/contract read", "focused checks"],
      "codeFacing": true
    },
    {
      "id": "planning",
      "useWhen": "Product, design, or architecture decision before code.",
      "requiredGates": ["durable plan artifact when useful"],
      "codeFacing": false
    }
  ],
  "tracker": {
    "provider": "none",
    "project": null,
    "authorityRule": "Tracker reflects execution state when configured; this app has no durable tracker.",
    "recordWhen": ["medium or large change", "follow-up or coordination need"],
    "dispositions": ["none", "blocked"]
  },
  "codeIntelligence": {
    "provider": "focused-search",
    "availability": {
      "configuredPreference": "focused-search",
      "detectedRepoSupport": "not-required",
      "currentHostAvailability": "not-required",
      "fallbackCommandReadiness": "not-required"
    },
    "mcp": null,
    "wrapperFallback": null,
    "statusCommand": null,
    "refreshCommand": null,
    "queryCommand": null,
    "contextCommand": null,
    "impactCommand": null,
    "detectCommand": null,
    "freshnessGate": {
      "enabled": false,
      "policy": "Not required for focused-search."
    },
    "fallback": "Use focused source search and route through README, PRODUCT.md, and contracts."
  },
  "contracts": {
    "featureArtifacts": ["docs/feature-artifacts"],
    "stateContracts": ["docs/state-contracts"],
    "surrogates": ["README.md"]
  },
  "verification": {
    "focusedChecksFirst": true,
    "requiredCommands": ["npm test"],
    "optionalCommands": [],
    "knownFailures": null,
    "browser": {
      "provider": "none",
      "origin": null,
      "artifacts": null,
      "policy": "Use an explicit skip reason when browser verification is not relevant."
    }
  },
  "uiUx": {
    "designSystemDocs": [],
    "visualSignoff": "human",
    "browserEvidencePolicy": "functional-only unless this profile explicitly allows visual signoff"
  },
  "manifest": {
    "defaultDir": "tmp/apex-workflow",
    "finishPacket": [
      "What landed",
      "Mode",
      "Downshift proof",
      "Owned files",
      "No-touch preserved",
      "Verified commands",
      "Failed / skipped checks",
      "Manual evidence",
      "GitNexus freshness",
      "Code-intelligence scope",
      "Tracker update",
      "Next safe slice"
    ]
  }
}
